{
  "$schema": "https://json-schema.org/draft/2020-12/schema",
  "$id": "https://agentclash.dev/schemas/voice-source-separation-report.schema.json",
  "title": "AgentClash Voice Source Separation Report",
  "type": "object",
  "required": ["schema_version", "type", "status", "passed", "metrics"],
  "additionalProperties": true,
  "properties": {
    "schema_version": {
      "type": "string",
      "minLength": 1
    },
    "type": {
      "type": "string",
      "pattern": "^\\s*(agentclash\\.voice\\.source_separation_eval\\.v1|voicey\\.source_separation_eval)\\s*$"
    },
    "status": {
      "enum": ["passed", "failed", "degraded"]
    },
    "passed": {
      "type": "boolean"
    },
    "metrics": {
      "type": "object",
      "required": ["dialogue_retention_ratio", "background_preservation_ratio", "speech_drop_risk"],
      "additionalProperties": true,
      "properties": {
        "dialogue_retention_ratio": { "type": "number", "minimum": 0, "maximum": 1 },
        "background_preservation_ratio": { "type": "number", "minimum": 0, "maximum": 1 },
        "speech_drop_risk": { "type": "number", "minimum": 0, "maximum": 1 },
        "background_leakage_in_dialogue_ratio": { "type": "number", "minimum": 0, "maximum": 1 },
        "dialogue_leakage_in_background_ratio": { "type": "number", "minimum": 0, "maximum": 1 }
      }
    },
    "caveats": {
      "type": "array",
      "items": { "type": "string" }
    },
    "agentclash_notes": {
      "type": "array",
      "items": { "type": "string" }
    },
    "artifacts": {
      "type": "object",
      "additionalProperties": { "type": "string" }
    }
  },
  "oneOf": [
    {
      "properties": {
        "status": { "const": "passed" },
        "passed": { "const": true }
      }
    },
    {
      "properties": {
        "status": { "enum": ["failed", "degraded"] },
        "passed": { "const": false }
      }
    }
  ]
}
